{
  "schema": "pweh.step-result/v1",
  "case_id": "example-hikvision-sample",
  "skill": "cctv-auth-bypass-hunt",
  "step": "triage",
  "status": "in-progress",
  "summary": "fwtriage 완료: vendor hikvision-like, 문자열 매치 7",
  "started_at": null,
  "finished_at": "2026-10-18T17:40:09.597Z",
  "data": {
    "strings_hunt": "analysis/strings-hunt-001.json",
    "rootfs_audit": "analysis/rootfs-audit-002.json"
  },
  "artifacts": [],
  "next_actions": [],
  "blockers": [],
  "seq": 6
}
